{
  "$schema": "../schemas/transition.schema.json",
  "schemaVersion": "1.0",
  "key": "auth.transition.password-sign-in.mfa-required",
  "name": "Password Sign-In MFA Required",
  "summary": "Accepts a valid password for an identity that still requires an additional authentication factor, without issuing an authenticated application session. Provider-specific client routing is a presentation responsibility and does not create a separate server transition.",
  "version": 1,
  "maturity": "implemented",
  "categoryKey": "password-sign-in",
  "priority": 95,
  "sourceState": { "expression": "session-capability == anonymous" },
  "actionKey": "auth.action.password-sign-in.submit",
  "guards": [
    { "expression": "password authentication is accepted and the account requires an additional factor before application sign-in can complete", "failureCode": "password-sign-in-mfa-not-required" }
  ],
  "destinationTransform": [
    { "dimensionKey": "auth.dimension.session-capability", "operation": "derive", "valueExpression": "anonymous" },
    { "dimensionKey": "auth.dimension.credential-proof", "operation": "set", "valueExpression": "password-proved" }
  ],
  "requiredEffects": ["preserve-anonymous-session", "return-mfa-required", "preserve-password-proof-for-client-flow"],
  "forbiddenEffects": ["issue-authenticated-session", "create-durable-user", "change-password-credential", "report-valid-password-as-invalid-credentials"],
  "invariantKeys": ["auth.invariant.transition.one-state-changing-action", "auth.invariant.transition.deterministic-post-state"],
  "sourceReferences": [
    { "sourceType": "code", "reference": "src/LagoVista.AspNetCore.Identity/Managers/SigninManager.cs", "note": "Maps Microsoft.AspNetCore.Identity.SignInResult.RequiresTwoFactor to AuthenticationResponseState.MfaRequired without completing application sign-in." },
    { "sourceType": "code", "reference": "src/LagoVista.UserAdmin/Authentication/Flows/PasswordLoginFlowHandler.cs", "note": "Emits this transition when the successful manager result carries AuthenticationResponseState.MfaRequired." },
    { "sourceType": "code", "reference": "src/LagoVista.UserAdmin/Authentication/AuthenticationFlowService.cs", "note": "Allows the MFA-required transition through the stable password-login application boundary." },
    { "sourceType": "decision", "reference": "auth-model/CLIENT-RESPONSE-ROUTING.md", "note": "Provider-specific TOTP or passkey navigation is modeled as response-directed client routing after this generic server outcome." }
  ]
}
