{
  "$schema": "../schemas/transition.schema.json",
  "schemaVersion": "1.0",
  "key": "auth.transition.totp-recovery-sign-in.success",
  "name": "TOTP Recovery Code Sign-In Success",
  "summary": "Consumes one valid TOTP recovery code for the password-proved durable identity, invalidates the lost authenticator enrollment, disables TOTP until re-enrollment, and establishes a normal authenticated application session.",
  "version": 1,
  "maturity": "proposed",
  "categoryKey": "totp-sign-in",
  "priority": 100,
  "sourceState": { "expression": "session-capability == anonymous and password-issued-mfa-challenge == pending" },
  "actionKey": "auth.action.totp-recovery-sign-in.submit",
  "guards": [
    { "expression": "the MFA challenge is valid for the same durable identity, TOTP is enabled, and the submitted recovery code is valid and unused", "failureCode": "totp-recovery-sign-in-not-successful" }
  ],
  "destinationTransform": [
    { "dimensionKey": "auth.dimension.session-capability", "operation": "derive", "valueExpression": "authenticated-normal" },
    { "dimensionKey": "auth.dimension.credential-proof", "operation": "set", "valueExpression": "recovery-code-proved" },
    { "dimensionKey": "auth.dimension.totp-enrollment", "operation": "clear", "valueExpression": "disabled-pending-reenrollment" }
  ],
  "requiredEffects": ["consume-one-recovery-code", "consume-mfa-challenge", "invalidate-current-totp-authenticator", "disable-totp-until-reenrollment", "issue-authenticated-session", "record-recovery-code-authentication-success", "resolve-application-landing-destination"],
  "forbiddenEffects": ["create-durable-user", "change-password-credential", "authenticate-without-primary-proof", "disclose-account-existence-on-failure"],
  "invariantKeys": ["auth.invariant.transition.one-state-changing-action", "auth.invariant.transition.deterministic-post-state"],
  "sourceReferences": [
    { "sourceType": "code", "reference": "src/LagoVista.UserAdmin/Managers/AppUserMfaManager.cs", "note": "ConsumeRecoveryCodeAsync consumes one recovery code, replaces the remaining-code blob, removes the current authenticator secret, sets TwoFactorEnabled false, and updates LastMfaDateTimeUtc when used as step-up." },
    { "sourceType": "code", "reference": "src/LagoVista.UserAdmin/Authentication/Flows/RecoveryCodeAuthenticationFlowHandler.cs", "note": "The handler resolves the durable identity exclusively from the password-issued MFA challenge, invokes the real recovery-code manager as step-up, and consumes the MFA challenge only after successful recovery proof." },
    { "sourceType": "code", "reference": "src/LagoVista.UserAdmin/Authentication/AuthenticationFlowService.cs", "note": "Successful recovery proof is adapted into either the normal browser application session or the standard mobile token session." }
  ]
}
